{"title":"my-post","units":[{"ref":"my-post","stage":"brief","hasDraft":true,"notes":["文本检查提示：合并后的配置有禁用词（Banned Term），但没有生效的 banned-terms 规则，文本检查不会检查它们；请在规范包或 config.yaml 中定义该类型的规则（lint.inactive-terms）"],"global":[{"kind":"lint","label":"warning length","severity":"warning","message":"字数（Word Count）为 77，少于下限 800","suggestion":""}],"paragraphs":[{"index":1,"line":1,"text":"重写大型单体最怕的不是写新代码，而是没人说得清旧边界。","origin":"agent","findings":[]},{"index":2,"line":3,"text":"我们先把服务间调用冻结成契约测试，再动第一行代码。","origin":"agent","findings":[]},{"index":3,"line":5,"text":"事故率下降了 40%，构建时间从 25 分钟降到 3 分钟。","origin":"agent","findings":[]}]}],"confirms":[{"kind":"decision","unit":"","id":"dec-1","label":"决策（Decision）dec-1：论断（Claim）my-post 以 data 登记「事故率下降了 40%，构建时间从 25 分钟降到 3 分钟」只关联了非作者亲历素材，允许吗？","detail":"需要亲历素材的论断类型只关联了非亲历素材：默认改用 fact 或补登亲历素材，等待作者决定是否允许例外","options":[{"id":"a","text":"允许"},{"id":"b","text":"保持不变"}],"recommend":"b","needsAnswer":false,"canReject":false}],"strict":true,"reviews":[],"failures":[]}